{
  "task_id": "be-08-03",
  "domain": "backend",
  "goal": "Fix two warning-level findings the QA gate panel raised against the max_turns descope (be-08-02, commit 6baf9d3, now on feat/cmux-3a-commands): (1) the buildRecord throw cites 'ADR-014 in architecture-notes.md', but architecture-notes.md has no ADR-014 entry, and ADR-014 is already claimed by an unrelated proposed decision in the parked deterministic-backbone package (tasks/deterministic-backbone/architecture-package-v2.md) — renumber to ADR-016 (the next free number; 010-013 ratified, 014-015 proposed/claimed by deterministic-backbone) and actually write the memory entry. (2) the max_turns refusal fires inside buildRecord, which runs AFTER dispatchCmd has already created a git worktree, a branch, a worktrees.json entry, and a snapshot directory (ensureWorktree + snapshotWorkerPlugin) with no cleanup — a loud refusal that leaks state. Hoist the check to fire before those side effects.",
  "files_in_scope": [
    "scripts/cmux/record.mjs",
    "scripts/cmux/dispatch.mjs",
    "references/cmux-dispatch.md",
    "test/cmux-record.test.mjs",
    "test/cmux-dispatch.test.mjs",
    ".claude/dev-team/memory/architecture-notes.md"
  ],
  "constraints": [
    "Do not touch the reviewer pane-flip work — it was reverted (commit 12aa2dd reverts a980922) after the QA panel found a separate, unrelated blocking defect (worktree/postcondition collision) that needs its own design pass. Not this task's concern.",
    "Do not duplicate the three-source max_turns resolution logic (config.maxTurns -> resolved.max_turns -> roster.defaults.max_turns) in two places. Extract it into one small shared function both call sites use.",
    "conventions.md: every functional commit bumps .claude-plugin/plugin.json's version and ends the commit message '; bump 0.<major>.<minor>'. Current HEAD is 0.1.54.",
    "Mirror the existing precedent for hoisting a refusal above side effects: scripts/cmux/dispatch.mjs:688-694 has a comment block explaining exactly this pattern for the workspace-liveness check ('hoisted ABOVE any record write ... before a record ever exists on disk to strand in create state') — match that reasoning and comment style for the max_turns check."
  ],
  "acceptance_criteria": [
    "grep -rn 'ADR-014' scripts/cmux/ references/ returns nothing; both citation sites now say ADR-016.",
    ".claude/dev-team/memory/architecture-notes.md gains a real ADR-016 entry recording 'cmux pane mode has no turn budget, by mechanism, not by omission' — the worker plugin ships only Stop/UserPromptSubmit hooks, a Stop-based counter would duplicate gate.max_blocks, the runaway bound is parent-side timeout_s, max_turns stays schema-present but is refused (not silently accepted) if ever set non-null.",
    "In dispatchCmd (scripts/cmux/dispatch.mjs), the max_turns resolution + refusal happens before ensureWorktree() and snapshotWorkerPlugin() are called — i.e. before any worktree/branch/snapshot-dir side effect for this dispatch.",
    "buildRecord (scripts/cmux/record.mjs) still throws too, as a correctness backstop for any caller that doesn't go through dispatchCmd (e.g. direct test construction) — both call sites use the same extracted resolution function, not copy-pasted logic.",
    "The three existing buildRecord-throws-per-source tests in test/cmux-record.test.mjs still pass unmodified in substance (they may need updating only if the extracted function's error message format changed).",
    "A new test in test/cmux-dispatch.test.mjs proves the hoisted check: dispatching with a non-null max_turns (via a config sidecar or equivalent) refuses BEFORE any worktree is created — assert no worktree/branch/snapshot-dir exists on disk after the refusal (e.g. via worktrees.json staying empty, or the snapshot dir not existing).",
    "Full suite (node --test) green.",
    "code-reviewer-deep review required (scripts/cmux/*.mjs is this repo's contract-freeze deep-review class per config.md); a full adversarial panel is not required for this narrow follow-up since all three original panel members already independently endorsed this exact fix direction — note that in the PR description."
  ],
  "validation_commands": [
    "node --test test/cmux-record.test.mjs test/cmux-dispatch.test.mjs"
  ],
  "discovery_context": "ADR numbering: read .claude/dev-team/memory/architecture-notes.md yourself to confirm current state, but as of this task's authoring: ADR-010 (D17 verdict blocks), ADR-011 (D16 noise filter), ADR-012 (enforcement layering, ratified 2026-08-01), ADR-013 (contract freeze structural, ratified 2026-08-01) are all in architecture-notes.md. ADR-014 and ADR-015 are PROPOSED (not ratified, not in architecture-notes.md at all) inside tasks/deterministic-backbone/architecture-package-v2.md (ADR-014 = 'the phase-chain runner is a resumable step machine', ADR-015 = 'one validator over returns/, gates are a separate post-completion evidence layer') — a completely different, unrelated, still-parked epic. So ADR-016 is the correct next number for this decision.\n\nExact citation sites to fix: scripts/cmux/record.mjs:541 (the throw message: 'is not implemented (see ADR-014 in architecture-notes.md) — the CLI turn ...') and references/cmux-dispatch.md:57 ('... by design (see ADR-014 in architecture-notes.md)'). Change both to ADR-016.\n\nADR-016 memory entry content (write into architecture-notes.md following the file's existing entry format/voice, dated same as other entries in that file): 'cmux pane mode has no turn budget, by mechanism, not by omission. {\"continue\": false} can only truncate a RUNNING agent loop, and the worker plugin (scripts/cmux/worker-plugin/hooks/hooks.json) ships exactly two hook events: Stop (fires after the loop has already ended) and UserPromptSubmit (fires only at kickoff, which must never block, and at a human interjection, which gate-mode.sh's own settled invariant says must never be force-stopped either). A Stop-based counter's entire delta over the existing gate.max_blocks counter is events it must not act on. The runaway/hang bound is therefore wall-clock timeout_s, parent-side (ladder.mjs, measured from record.created_at). max_turns stays in the frozen schemas as integer|null but is inert by refusal: buildRecord (and, as of #8's follow-up, dispatchCmd before any worktree/snapshot side effect) throws on any non-null value from any of its three sources (config override, role override, roster default); the --max-turns CLI-flag emission was deleted (it was already unreachable — roster default null, zero role overrides). Re-entry condition: a future probe showing claude --max-turns N is honored in interactive (non-print) mode would move enforcement to the CLI layer per ADR-012, never to a hook. Supersedes: the references/cmux-dispatch.md:57 promise of a future Phase-3 gate counter.'\n\nHoisting the check: scripts/cmux/dispatch.mjs's dispatchCmd currently resolves `const resolved = roster.roles[role]` at line 666, then does the workspace-liveness refusal (lines 688-698, the pattern to mirror), then derives attempt (line 708), then at lines 710-718 conditionally calls ensureWorktree if resolved.isolation === 'worktree', then unconditionally calls snapshotWorkerPlugin at line 722. resolved.max_turns (role override) and roster.defaults.max_turns and config.maxTurns are ALL available by line 666-708, before any of the worktree/snapshot side effects. Insert the max_turns check there, using the same three-source priority order buildRecord uses today (scripts/cmux/record.mjs:535-537: config.maxTurns !== undefined ? config.maxTurns : (resolved.max_turns !== undefined ? resolved.max_turns : roster.defaults.max_turns)).\n\nExtract that resolution + throw into one function (suggested name: resolveMaxTurnsOrThrow({config, resolved, defaults}) or similar, living in record.mjs since that's where the logic currently lives and dispatch.mjs already imports from record.mjs) and call it from both dispatchCmd (early, before side effects) and buildRecord (as the existing backstop — buildRecord can just call the same function and keep using its return value for record.max_turns, which should always be null after the guard, but keep assigning it explicitly rather than assuming, for clarity).",
  "out_of_scope": [
    "The reverted reviewer pane-flip work (roster.default.json pane flags, agents/*.md Verdict sections, contract.mjs PANE_ROLES, the roster.test.mjs coherence guard) — separate follow-up, not this task.",
    "The extractSection runtime shadowing guard on worker return bodies — also part of the pane-flip follow-up, not needed while those roles are pane:false.",
    "roster.schema.json's max_turns type/description (still schema-valid as a settable integer while the runtime refuses it) — flagged by the panel as a should-fix but not required for this narrow amendment; note it as a follow-up if you notice it again but don't fix it here.",
    "tasks/deterministic-backbone/cmux-design-record.md's stale reference to gate max_turns enforcement being planned for #8 — that's a parked planning doc in a different epic, not this repo's shipped contract; leave it.",
    "references/cmux-dispatch.md's role-count line (currently accurate again since the pane-flip revert restored PANE_ROLES to seven) — no change needed there."
  ],
  "depends_on": [],
  "interface_contract": "none — this is a narrow correctness fix to already-shipped code (commit 6baf9d3), no new shape shared with any other task."
}
