{
  "task_id": "doc-10-01d",
  "domain": "backend",
  "goal": "Append 15 new dated convention entries to .claude/dev-team/memory/conventions.md — the cmux execution-mode conventions that currently exist only in epic #15's comment history, never yet committed to memory. This is deliverable D of 4 for issue #10, all dispatched in parallel against disjoint files in the same PR; you touch only this one file.",
  "files_in_scope": [
    ".claude/dev-team/memory/conventions.md"
  ],
  "constraints": [
    "APPEND-ONLY. Do not edit, reword, re-date, reorder or deprecate any existing entry (lines 1-39); do not touch the file header or format lines. New content goes strictly after the current last line. `git diff --numstat` must show 0 deletions.",
    "Format: one bullet per convention, dated, in the file's existing one-bullet/`*Why:*` idiom (excerpt below) — real prose (2-3 sentences), not a one-line index copy from the issue body. Date all 15 **2026-08-01** (the decision date — this file dates entries by decision date, not chronologically, so an 2026-08-01 entry after later-dated ones is correct and expected). End each with a source citation naming the epic-#15 comment and section plus 'recorded 2026-08-05, issue #10'.",
    "THE COUNT IS EXACTLY 15, NOT 16. One source (v2.1 §R6) proposes a 16th ('any verdict that drives control flow is structured data with a fixed enum, validated mechanically; quality judgments stay agent-side and are never linted') — fold this as a final clause on convention #2 (control/data plane) rather than minting a 16th entry, because ADR-002 (being committed to architecture-notes.md by a parallel task) already carries the same rule as its own consequence line. The issue body fixes the count at 15 — do not deviate.",
    "Three of the 15 overlap with entries already committed to this file — cross-reference them explicitly rather than silently duplicating or contradicting (map below)."
  ],
  "acceptance_criteria": [
    "D1 — the file gains exactly 15 new dated bullets (`grep -c '^- \\*\\*2'` goes 29 -> 44), in the existing one-bullet/`*Why:*` format, each with real prose (2-3 sentences) and a source citation; the existing 29 entries are byte-unchanged.",
    "D2 — the three known overlaps with already-committed entries are cross-referenced, never silently duplicated or contradicted: convention 4 (CMUX_BIN/CLAUDE_BIN mockability seams) names conventions.md's existing 2026-08-02 `<TOOL>_BIN` entry as its general form; convention 9 (allowlist-shaped worker profiles) cross-references the existing architecture-notes.md entries on lines 16 and 21; convention 8 (tmp+rename for UI-backing files) states how it differs in purpose from conventions.md's existing exclusive-create/TOCTOU rule entry."
  ],
  "validation_commands": [
    "git -C /Users/x/Development/dev-team-claude-plugin diff --numstat -- .claude/dev-team/memory/conventions.md",
    "grep -c '^- \\*\\*2' /Users/x/Development/dev-team-claude-plugin/.claude/dev-team/memory/conventions.md"
  ],
  "discovery_context": "NO AUTOMATED COVERAGE EXISTS FOR THIS CHANGE. Expected values: numstat deletions column 0; dated-entry count 44 (29 existing + 15 new). Acceptance is otherwise reviewer-verified source fidelity.\n\n=== READ FIRST ===\nThe project's `.claude/dev-team/memory/conventions.md` (your files_in_scope target) itself, in full — you need its existing format, the three entries your cross-references point at (search for '<TOOL>_BIN', the allowlist-shaped/dontAsk entries, and the exclusive-create/TOCTOU entry), and its own dating convention.\n\nEXCERPT — the entry format to match (this file's line 13):\n  - **2026-08-01** — Test suite (`node --test`) runs the full 87-test suite in under 1 second. *Why:* means `validate.fast` and `validate.full` are identical here — no separate slow/fast split is needed. Source: timed run at onboarding.\n\n=== SOURCE FILES (all staged in-repo and already tracked; read them directly, never fetch GitHub) ===\nAll under /Users/x/Development/dev-team-claude-plugin/.claude/dev-team/tasks/issue-10/ :\n- issue-10-body.md — lists all 15 conventions by short title/index; use these as your checklist of what must appear, not as the prose to copy (they're one-line stubs; you need to write real 2-3 sentence prose per entry from the fuller sources below).\n- epic15-c3-v1-full.md — source for convention 2's core (ADR-002, filesystem = data plane / socket = control plane, at lines 388-390).\n- epic15-c6-v2-full.md — primary source, sections cited per-convention below.\n- epic15-c8-v2.1-full.md — source for conventions 12's amendment and 13-15: §K lines 212-215 (conventions 13-15 text), the convention-12 amendment at line 217, §R6 at line 237 (the verdict-enum clause to fold into convention 2, see constraints).\n\n=== PER-CONVENTION SOURCE MAP (the canonical 12 from v2:642, #12 amended by v2.1 §K:217, plus §K:212-215's 13th-15th) ===\n1. dispatch only via dispatch.mjs — v2 §4.1:112, §5.8:410.\n2. control plane vs data plane: read-screen is diagnostics only, send carries single-line control text only — v1 ADR-002:388-390 (plus v2.1 §R6:237's verdict-enum clause folded in per constraints, above).\n3. the adapter contract is two verbs (capabilities, run) and always a return file plus one EXIT-trap signal — v1 §5.3:239-249, v2 §5.3:267-272.\n4. CLI-dependent subsystems get a <TOOL>_BIN mockability seam — v2 §8:517. (Cross-reference the existing conventions.md entry per constraints.)\n5. single-source role prompts — substrate addenda live under scripts/, never forks of agents/*.md, and never inside agents/ where they'd be auto-discovered as a subagent — v2 §4.6:167-168.\n6. one on-demand reference file per subsystem — v2 §5.1:189, §12.10:599, §J:148.\n7. persist UUIDs, never positional refs, and re-read before acting — v2 §4.4:144-145, §5.2:226.\n8. UI-backing files are overwritten in place or tmp+rename, never rm-then-recreate — v2 §4.4:147, R16:558. (Cross-reference the existing conventions.md entry per constraints, stating how the purposes differ.)\n9. worker profiles are allowlist-shaped under a non-prompting mode — v2 §4.6:165, G1/G3 at lines 88/90. (Cross-reference the existing architecture-notes.md entries per constraints.)\n10. hooks own their loop bounds and never rely on stop_hook_active — v2 §5.6:380, G10:97, R15:557.\n11. environment prerequisites fail loudly with precise remediation, never a silent substrate swap — v2 §5.5:341-349, and the ADR-008 concept (a parallel task is writing ADR-008's full text into architecture-notes.md — you only need the convention-level statement here, not ADR prose).\n12. pane system prefixes are byte-stable per role AND the per-dispatch payload travels as expanded literals in the first user message, env vars being for shell-side consumers which the model is not — v2 §5.9:414-420 + v2.1 §K:217 (the amendment).\n13. enforcement models don't merge — v2.1 §K:213.\n14. a doorbell that cannot name the sleeper only wakes; it never decides — v2.1 §K:214.\n15. filters apply to what an agent reads, never to what a check verifies — v2.1 §K:215.\n\n=== GOTCHAS ===\nThree other coders are, in parallel, writing the new TRD document, RECREATION-SPEC.md, and architecture-notes.md for the same issue — you do not need to read or wait on their output.",
  "out_of_scope": [
    "Any file other than .claude/dev-team/memory/conventions.md.",
    "Editing, re-dating, reordering, or deprecating any existing entry in this file, or editing its header/format lines.",
    "Creating a 16th convention entry.",
    "Writing TRD or ADR prose (parallel tasks' deliverables).",
    "git commits, the PR, board moves, and closing issue #10 — all orchestrator-side (this includes the version bump in .claude-plugin/plugin.json)."
  ],
  "depends_on": [],
  "interface_contract": "none — prose deliverable only; no schema, API payload, or code shape is defined or consumed by this task."
}
