{
  "task_id": "be-28-01",
  "domain": "backend",
  "goal": "Expose return-lint.mjs's verdict-block extraction as a named export so B1's gates.mjs can read a reviewer's parsed {verdict, findings} without re-parsing markdown. Purely additive and behavior-preserving: extract the body of verdictBlockViolations into a new exported extractVerdictBlock(body) that returns either the parsed verdict object or the exact violation it already returns today, and reimplement verdictBlockViolations on top of it. No behavior change, no new failure mode, no schema_version event.",
  "files_in_scope": [
    "scripts/cmux/return-lint.mjs",
    "test/return-lint.test.mjs"
  ],
  "constraints": [
    "conventions.md 'a fenced ## Findings example satisfied required_sections — an accept-a-fake hole' (backend-notes.md 2026-08-02): the fence-aware realHeadings/extractSection/extractFencedBlocks trio must be reused verbatim, never widened, never duplicated.",
    "conventions.md 2026-08-08 'a frozen exported enum's drift guard needs Object.isFrozen alongside deepEqual' — if you freeze anything new, pin both.",
    "conventions.md 2026-08-01 'every functional commit bumps plugin.json' — NOT in this spec; be-28-03 owns the single bump for this PR.",
    "backend-notes.md 2026-08-01 'throw on contract-author error, return violations on data error' — extractVerdictBlock returns a discriminated result, never throws on worker data.",
    "Behavior-preserving refactor only: verdictBlockViolations' externally observable output must be byte-identical for every input, including the guard clauses (verdict_block false, kind !== 'markdown', non-string body) which stay in verdictBlockViolations and are NOT moved into extractVerdictBlock."
  ],
  "acceptance_criteria": [
    "scripts/cmux/return-lint.mjs exports extractVerdictBlock(body) with signature: returns {ok: true, verdict, findings} on success, or {ok: false, keyword, message} where keyword is one of the existing exported constants VERDICT_SECTION_MISSING / VERDICT_BLOCK_MISSING / VERDICT_BLOCK_MULTIPLE / VERDICT_BLOCK_UNPARSEABLE / VERDICT_BLOCK_INVALID and message is the corresponding existing *_MESSAGE constant (with the same err.message / schema-detail suffixes appended as today).",
    "verdictBlockViolations is reimplemented as: its three existing guard clauses, then `const res = extractVerdictBlock(envelope.body); return res.ok ? [] : [{ keyword: res.keyword, message: res.message }]`. No other change to the function.",
    "Every pre-existing test in test/return-lint.test.mjs passes unmodified — proof the refactor is behavior-preserving. If any pre-existing test needed editing, that is a behavior change and the coder must return `blocked` rather than edit it.",
    "New tests in test/return-lint.test.mjs, positives first: (1) a body with a real '## Verdict' section containing one ```json block returns {ok:true} with the exact verdict string and findings array; (2) a body containing BOTH an illustrative fenced example that itself contains a '## Verdict' heading AND the real Verdict section returns the REAL block's values — the pin that the fence-aware realHeadings path is actually being used; (3) each of the five failure keywords is produced by its own single-mutation negative, asserted with deepEqual on the full {ok:false, keyword, message} object (exactly one result, right reason — backend-notes.md 2026-08-01 Violation-shape rule); (4) all three VERDICT_ENUM values ('pass','changes-needed','inconclusive') round-trip through {ok:true}; (5) a Verdict section with one ```json block plus one untagged illustrative block returns the json-tagged one (the SF2 disambiguation path).",
    "Degenerate assertion: a stub extractVerdictBlock that always returns {ok:true, verdict:'pass', findings:[]} must fail at least three of the new tests — state in a comment which ones.",
    "Review depth: code-reviewer-deep is REQUIRED (scripts/cmux/*.mjs is the contract-freeze surface, config.md review_defaults line 46) and this file participates in the adversarial 3-reviewer panel + test-engineer mutation pass already decided for issue #28 by the qa-lead consult. The mutation pass runs first and alone on the frozen tree.",
    "`node --test test/return-lint.test.mjs` green; no new test takes measurable wall time (pure string functions, no spawn, no git, no fs)."
  ],
  "validation_commands": [
    "node --test test/return-lint.test.mjs"
  ],
  "discovery_context": "This repo has no typecheck or lint tooling — plain JS + node:test (conventions.md 2026-08-01).\n\nTHE FUNCTION TO REFACTOR — scripts/cmux/return-lint.mjs:217-261. Paste of the current body (the three guard clauses stay put; everything from `const section =` down moves into extractVerdictBlock):\n\n    function verdictBlockViolations(record, envelope) {\n      if (!record.return.verdict_block) return []\n      if (!envelope || record.return.kind !== 'markdown' || typeof envelope.body !== 'string') return []\n\n      const section = extractSection(envelope.body, 'Verdict')\n      if (section === null) {\n        return [{ keyword: VERDICT_SECTION_MISSING, message: VERDICT_SECTION_MISSING_MESSAGE }]\n      }\n\n      const blocks = extractFencedBlocks(section)\n      if (blocks.length === 0) {\n        return [{ keyword: VERDICT_BLOCK_MISSING, message: VERDICT_BLOCK_MISSING_MESSAGE }]\n      }\n\n      let candidate = blocks[0]\n      if (blocks.length > 1) {\n        const jsonTagged = blocks.filter((b) => b.info === 'json')\n        if (jsonTagged.length !== 1) {\n          return [{ keyword: VERDICT_BLOCK_MULTIPLE, message: VERDICT_BLOCK_MULTIPLE_MESSAGE }]\n        }\n        candidate = jsonTagged[0]\n      }\n\n      let parsed\n      try {\n        parsed = JSON.parse(candidate.content)\n      } catch (err) {\n        return [{ keyword: VERDICT_BLOCK_UNPARSEABLE, message: `${VERDICT_BLOCK_UNPARSEABLE_MESSAGE}: ${err.message}` }]\n      }\n\n      const schemaViolations = validate(VERDICT_SCHEMA, parsed)\n      if (schemaViolations.length > 0) {\n        const detail = schemaViolations.map((v) => `${v.path} (${v.keyword})`).join(', ')\n        return [{ keyword: VERDICT_BLOCK_INVALID, message: `${VERDICT_BLOCK_INVALID_MESSAGE}: ${detail}` }]\n      }\n\n      return []\n    }\n\nEach `return [{...}]` becomes `return { ok: false, keyword: ..., message: ... }`; the final `return []` becomes `return { ok: true, verdict: parsed.verdict, findings: parsed.findings }`.\n\nSYMBOLS YOU CALL BUT DO NOT DEFINE, all already in scripts/cmux/return-lint.mjs (module-private, no import needed): extractSection (defined at :165), extractFencedBlocks (:185), realHeadings (:132), VERDICT_SCHEMA (:75), VERDICT_ENUM (:69), SEVERITY_ENUM (:70). `validate` is imported from ./contract.mjs at the top of the file. Every VERDICT_* keyword and *_MESSAGE constant is already exported (:42-52).\n\nWHY THIS EXISTS: gates.mjs (be-28-03) needs the PARSED {verdict, findings} to run its verdict_consistent check. Today the only reachable API is verdictBlockViolations, which returns violations and is module-private anyway, and lintReturn, which needs a full dispatch record and reads disk. Issue #28 forbids gates.mjs re-parsing markdown independently — hence this export. gates.mjs must be able to import it WITHOUT a dispatch record, so extractVerdictBlock takes a bare body string, not (record, envelope).\n\nGOTCHA — DO NOT EXPORT extractSection/extractFencedBlocks/realHeadings individually. Exporting the primitives invites a future caller to recombine them differently, which is the exact accept-a-fake divergence backend-notes.md:16 records. Export the composed extractor only.\n\nGOTCHA — no closed export-manifest test guards this file. test/cmux-contract.test.mjs:578-589 pins contract.mjs's export set with a deepEqual; return-lint.mjs has no equivalent, so adding one export turns nothing red. Do not add such a manifest here.\n\nTEST FILE: test/return-lint.test.mjs already imports from '../scripts/cmux/return-lint.mjs' — extend the existing import list. It uses node:test + node:assert/strict and the ROOT helper from ./helpers.mjs. Follow its existing positives-first ordering (conventions.md 2026-08-02).\n\nASSUMPTION STATED: extractVerdictBlock returns `findings` as whatever VERDICT_SCHEMA validated — an array of finding objects. gates.mjs will read `f.severity`, `f.file`, `f.line`, `f.summary` off each entry; if VERDICT_SCHEMA's finding shape names those fields differently, report the real field names in your return's `reason` so be-28-03's spec can be corrected before it is dispatched.",
  "out_of_scope": [
    "Any change to lintReturn, writeBlockedReturn, buildBlockedMarkdownBody, destinationHoldsFreshNonBlockedReturn, main, or the CLI surface.",
    "Widening or altering the fence-tracking semantics of realHeadings / extractSection / extractFencedBlocks.",
    "Any change to VERDICT_SCHEMA, VERDICT_ENUM, SEVERITY_ENUM, or any *_MESSAGE constant text.",
    "Any file under scripts/chain/ — that is be-28-02 and be-28-03.",
    "Bumping .claude-plugin/plugin.json — be-28-03 owns the single bump for this PR.",
    "Editing .claude/dev-team/config.md or anything under .claude/dev-team/memory/ (orchestrator-only)."
  ],
  "depends_on": [],
  "interface_contract": "extractVerdictBlock(body: string) -> { ok: true, verdict: 'pass'|'changes-needed'|'inconclusive', findings: object[] } | { ok: false, keyword: string, message: string }. Backend (this task) owns this shape; be-28-03's gates.mjs verdict_consistent check consumes it and must not redefine or re-derive it. `keyword` is always one of the five exported VERDICT_* constants from scripts/cmux/return-lint.mjs."
}
