{
  "task_id": "doc-10-01b",
  "domain": "backend",
  "goal": "Add one new section to RECREATION-SPEC.md — 'Part 15 — Execution substrate: Agent-tool vs. pane adapters (optional layer)' — describing the cmux pane-adapter execution substrate harness-agnostically, so a from-scratch recreation of this plugin can optionally adopt visible-pane execution without depending on cmux specifically. This is deliverable B of 4 for issue #10, all dispatched in parallel against disjoint files in the same PR; you touch only this one file.",
  "files_in_scope": [
    "RECREATION-SPEC.md"
  ],
  "constraints": [
    "Insert the new section as `## Part 15 — Execution substrate: Agent-tool vs. pane adapters (optional layer)`, placed after Part 14 and before `## Appendix A`. Do NOT renumber any existing Part 1-14 or Appendix A-C heading — every one of those headings must be byte-unchanged in your diff.",
    "Frame the entire section as an OPTIONAL layer: state up front that a faithful port needs none of it, that it trades implementation cost for human observability and interjection capability, and name the harness requirement it adds (a multiplexer with a scriptable control API, plus a filesystem both the orchestrator and worker sides can see) generically. Name cmux only once, as the reference implementation — never as a requirement.",
    "The preamble reading-guide sentence near the top of the file (roughly lines 9-11) currently describes the document's Part range; update it so it does not contradict the new Part 15. Part 14's checklist gains one new step (step 11) marked optional, pointing at Part 15. These are the only two other touch-points in the file — everything else stays untouched.",
    "Write in the register of Part 2 (the porting-layer capability table with fallbacks) and Part 13 (the numbered invariants list) — read both before writing so the new Part matches the file's existing tone and structure."
  ],
  "acceptance_criteria": [
    "B1 — RECREATION-SPEC.md gains `## Part 15 — Execution substrate: Agent-tool vs. pane adapters (optional layer)` placed after Part 14 and before `## Appendix A`, with five required subsections: roster (role -> agent/model/profile), adapter contract, file data plane / socket control plane, four-rank completion ladder, workspace-per-task lifecycle — framed as an optional layer, written harness-agnostically, cross-referencing Part 2's P-numbers and Part 13's invariant 1.",
    "B2 — the preamble reading-guide sentence is updated so it does not contradict the new part, and Part 14's checklist gains a step 11 marked optional pointing at Part 15. No existing Part or Appendix is renumbered; every other `## Part`/`## Appendix` heading is byte-unchanged."
  ],
  "validation_commands": [
    "node --test /Users/x/Development/dev-team-claude-plugin/test/orchestration.test.mjs",
    "git -C /Users/x/Development/dev-team-claude-plugin diff -- RECREATION-SPEC.md | grep -E '^-## (Part|Appendix)'"
  ],
  "discovery_context": "NO AUTOMATED COVERAGE EXISTS FOR THIS CHANGE. No test file reads RECREATION-SPEC.md. test/orchestration.test.mjs is an unrelated guard that must simply stay green (you touch nothing it covers) — run it only as a sanity check that nothing else broke. The second command is the mechanical no-renumbering check: it greps the diff for any REMOVED `## Part`/`## Appendix` heading line; expected output is empty (exit status 1 on no matches IS the pass case). Acceptance is otherwise reviewer-verified.\n\n=== SOURCE FILES (all staged in-repo and already tracked; read them directly, never fetch GitHub) ===\nAll under /Users/x/Development/dev-team-claude-plugin/.claude/dev-team/tasks/issue-10/ :\n- issue-10-body.md (27 lines) — deliverable 2's framing: 'one new section, \"Execution substrate: Agent-tool vs. pane adapters,\" framed as an optional layer so the spec stays harness-agnostic: roster (role -> agent/model/profile), adapter contract (capabilities + run <record>; always a return file + exactly one signal), file data plane / socket control plane, the four-rank completion ladder, workspace-per-task lifecycle.'\n- epic15-c6-v2-full.md (65KB) — content sources: roster -> §5.4 (lines 291-333) reduced to the concept (role -> agent/model/profile, per-role pane flag as the substrate lever, resolution precedence frontmatter->plugin default->global->project->session); adapter contract -> §5.3 (230-289) — two verbs (`capabilities`, `run <record>`), a single on-disk record as the whole input, and the output rule 'the adapter never leaves the orchestrator without a return file' plus exactly one completion signal per dispatch emitted from the adapter's EXIT trap (nuance: 'exactly one signal' means once per dispatch — the delivery itself splits into a filesystem sentinel that cannot fail plus a best-effort socket token, that's fine to mention); four-rank ladder -> §4.3's table (122-128); workspace-per-task lifecycle -> §5.5 (335-371) + §5.7's 'files are authoritative, panes are disposable' invariant (line 389). §9 (533-535) is this deliverable's own disposition instruction from the source package: 'one Execution substrate section via doc-writer at end of Phase 3' — read it for confirmation of scope.\n- epic15-c3-v1-section-3.1-3.3.md — background only if useful; not required reading for this deliverable.\n\n=== ALSO NEEDED ===\nADR-002 (filesystem = data plane; socket = control/signaling only) for the data-plane/control-plane subsection: full prose source is epic15-c3-v1-full.md lines 388-390 — a short read, one paragraph.\n\n=== ASSEMBLY NOTES ===\nCross-reference RECREATION-SPEC.md's existing Part 2's P1/P2/P5/P11 and Part 13's invariant 1 by reading those parts first (invariant 1 is likely about byte-stable/deterministic behavior — confirm by reading; ADR-009's byte-stable pane prefix, if you mention it, is that invariant applied to a visible substrate — one sentence, not a deep dive since ADR-009's full text is a parallel task's deliverable, not yours to write).",
  "out_of_scope": [
    "Any file other than RECREATION-SPEC.md.",
    "Renumbering RECREATION-SPEC.md Parts 1-14 or Appendices A-C, or restructuring anything outside the new Part 15 plus the two one-line touch-ups (preamble sentence, Part 14 checklist step).",
    "Writing ADR prose or convention prose (parallel tasks' deliverables) — reference them by name/number only if useful, do not duplicate their content.",
    "Naming cmux as a requirement anywhere in the new section.",
    "git commits, the PR, board moves, and closing issue #10 — all orchestrator-side."
  ],
  "depends_on": [],
  "interface_contract": "none — prose deliverable only; no schema, API payload, or code shape is defined or consumed by this task."
}
