{
  "task_id": "be-08-02",
  "domain": "backend",
  "goal": "Descope gate-side max_turns enforcement from issue #8 (it is structurally unbuildable with the current two-hook worker plugin — see discovery_context) and make the field inert by loud refusal instead of silent no-op. Delete the already-unreachable --max-turns CLI emission, make buildRecord throw if max_turns ever resolves non-null from any source, and correct the doc line that promises a future turn cap. Small, low-risk, independent of be-08-01 and qa-3b-01.",
  "files_in_scope": [
    "scripts/cmux/record.mjs",
    "references/cmux-dispatch.md",
    "test/cmux-record.test.mjs"
  ],
  "constraints": [
    "No schema_version bump: dispatch-record.schema.json's max_turns stays [\"integer\",\"null\"]; record.max_turns is still always present, just always null going forward.",
    "Do not touch scripts/cmux/roster.default.json or roster.schema.json's max_turns field definitions — the schema-level field is not being removed, only made unreachable.",
    "Do not add any new hook to scripts/cmux/worker-plugin/hooks/hooks.json and do not touch scripts/cmux/return-gate.sh or scripts/cmux/gate-mode.sh — this spec is CLI-emission + doc + guard only, no gate mechanism is being built (that was investigated and rejected, see discovery_context).",
    "conventions.md: every functional commit bumps .claude-plugin/plugin.json's version and ends the commit message '; bump 0.<major>.<minor>'.",
    "The throw message must name both 'max_turns' and 'ADR-014' so a future operator setting a roster/config max_turns value gets an actionable pointer, not a bare TypeError-style failure."
  ],
  "acceptance_criteria": [
    "grep -n 'max-turns' scripts/cmux/*.mjs returns nothing outside comments (the CLI-flag emission is fully removed).",
    "buildRecord throws a clear error naming 'max_turns' and 'ADR-014' when the resolved max_turns is non-null, regardless of which of the three sources set it: config.maxTurns, resolved.max_turns (role override), or roster.defaults.max_turns. Three separate tests, one per source.",
    "buildRecord does NOT throw, and record.max_turns is null, when none of the three sources set a value (today's default state — roster.default.json's defaults.max_turns is null and no role overrides it).",
    "The mutation test at test/cmux-record.test.mjs:641-652 ('buildArgv: emits --max-turns only when max_turns is non-null') is replaced: buildArgv must never emit --max-turns even when handed a hand-built record with max_turns: 20 (bypassing buildRecord's new guard, to prove buildArgv itself has no emission path left, not just that buildRecord blocks non-null values upstream).",
    "references/cmux-dispatch.md:57 no longer promises a Phase-3 turn cap; states that the runaway/hang bound is timeout_s (parent-side, from record.created_at), and that max_turns is schema-present but unenforced by design (points at ADR-014).",
    "scripts/cmux/worker-plugin/hooks/hooks.json is byte-identical before and after this change (verified by test/cmux-contract.test.mjs or an equivalent pinned check already in the suite — confirm one exists; if not, note it in the PR description rather than adding a new pinned-file test here, which is out of scope).",
    "Full suite (node --test) green; no schema_version changed anywhere."
  ],
  "validation_commands": [
    "node --test test/cmux-record.test.mjs"
  ],
  "discovery_context": "WHY this is being descoped, not built: dev-team:architecture-lead investigated turn-budget enforcement this session and found the worker plugin (scripts/cmux/worker-plugin/hooks/hooks.json) ships exactly two hooks, Stop -> return-gate.sh and UserPromptSubmit -> gate-mode.sh. {\"continue\": false} can only interrupt a RUNNING agent loop, and both available hooks fire at moments where there is no running loop to interrupt (Stop fires after the loop already ended; UserPromptSubmit fires only at kickoff, which must never block, and at a human interjection, which per gate-mode.sh's own settled invariant must never be force-stopped either). A Stop-based counter's only observable delta over the EXISTING gate.max_blocks counter (scripts/cmux/return-gate.sh) is events it must not act on. Building a new PostToolUse hook to count real inner-loop turns was considered and rejected: it would count tool calls, not turns (unit mismatch), it duplicates the ALREADY-EXISTING parent-side runaway bound timeout_s (ladder.mjs:428, `now - Date.parse(record.created_at) > timeout_s * 1000`, computed from parent-written fields the worker cannot touch) with strictly worse trust properties (a worker-tree counter sidecar is worker-writable), and it would be the first per-call hook in the worker plugin, reopening the per-call-latency concern that already ruled out a similar hook once before.\\n\\nCurrent exact code being changed: scripts/cmux/record.mjs:535-537 resolves max_turns from three sources in priority order: `const maxTurns = config.maxTurns !== undefined ? config.maxTurns : (resolved.max_turns !== undefined ? resolved.max_turns : roster.defaults.max_turns)` — config.maxTurns comes from a dispatch-time CLI arg, resolved.max_turns is the role's roster override (none set today), roster.defaults.max_turns is the roster-wide default (null in scripts/cmux/roster.default.json today, hence the field is currently always null and the emission below is already dead code, not merely risky). Line 577 stores it on the record: `max_turns: maxTurns,`. Lines 643-644 are the emission to delete: `if (record.max_turns !== null) { argv.push('--max-turns', String(record.max_turns)) }`.\\n\\nWhat to add: at the point maxTurns is resolved (record.mjs:535-537), after computing it and before it's used, throw if it is not null: something like `if (maxTurns !== null) { throw new Error('max_turns is set to ' + maxTurns + ' but gate-side turn-budget enforcement is not implemented (see ADR-014 in architecture-notes.md) — the CLI --max-turns flag emission was removed as unreachable/unenforceable; use timeout_s to bound a runaway worker instead') }`. Then delete lines 643-644 entirely (buildArgv never emits the flag, period — this makes the mutation test at test/cmux-record.test.mjs:641-652 need rewriting per the acceptance criteria above, since its current second half explicitly expects the flag to appear for max_turns:20).\\n\\nreferences/cmux-dispatch.md:57 current text: '**Fidelity notes:** pane workers inherit `CLAUDE.md`, project skills, and MCP servers (Agent-tool subagents do not). `maxTurns` is unenforceable on a pane interactively — there is no hard turn cap until the Phase-3 gate counter lands.' Replace the second sentence: the 'Phase-3 gate counter' promise is retracted (investigated and found unbuildable, not merely deferred) — state that the runaway/hang bound is timeout_s, and max_turns remains schema-present but is refused (not silently accepted) if ever set non-null, per ADR-014.\\n\\nADR-014 (recorded separately as a memory delta by this task, or already present if be-08-01/be-08-02 land in the same session — check .claude/dev-team/memory/architecture-notes.md before writing a duplicate entry): 'cmux pane mode has no turn budget, by mechanism, not by omission.'",
  "out_of_scope": [
    "Any change to scripts/cmux/worker-plugin/hooks/hooks.json, scripts/cmux/return-gate.sh, or scripts/cmux/gate-mode.sh.",
    "Any change to scripts/cmux/roster.default.json or roster.schema.json's max_turns field/description.",
    "Re-opening whether claude --max-turns N is honored in interactive (non-print) mode (tracked as a separate, non-blocking probe/follow-up issue, not built here).",
    "The outcome-classifier bug fix and reviewer pane flip (be-08-01) and the qa-gate.md doctrine rewrite (qa-3b-01) — fully disjoint files, no dependency either direction."
  ],
  "depends_on": [],
  "interface_contract": "record.max_turns is always null going forward (schema type unchanged: integer|null). buildArgv never emits --max-turns under any input. No other task in this batch reads or writes max_turns."
}
